<?xml version="1.0" encoding="UTF-8"?>
<HumanResources xmlns:xsi="http://www.w3.org/2001/XMLSchema-instance" xsi:noNamespaceSchemaLocation="hr_schema.xsd">
  <Regions>
    <Region region_id="10">
      <region_name>Europe</region_name>
    </Region>
    <Region region_id="20">
      <region_name>Americas</region_name>
    </Region>
    <Region region_id="30">
      <region_name>Asia</region_name>
    </Region>
    <Region region_id="40">
      <region_name>Oceania</region_name>
    </Region>
    <Region region_id="50">
      <region_name>Africa</region_name>
    </Region>
  </Regions>
  <Countries>
    <Country country_id="IT" region_id="10">
      <country_name>Italy</country_name>
    </Country>
    <Country country_id="JP" region_id="30">
      <country_name>Japan</country_name>
    </Country>
    <Country country_id="US" region_id="20">
      <country_name>United States of America</country_name>
    </Country>
    <Country country_id="CA" region_id="20">
      <country_name>Canada</country_name>
    </Country>
    <Country country_id="CN" region_id="30">
      <country_name>China</country_name>
    </Country>
    <Country country_id="IN" region_id="30">
      <country_name>India</country_name>
    </Country>
    <Country country_id="AU" region_id="40">
      <country_name>Australia</country_name>
    </Country>
    <Country country_id="ZW" region_id="50">
      <country_name>Zimbabwe</country_name>
    </Country>
    <Country country_id="SG" region_id="30">
      <country_name>Singapore</country_name>
    </Country>
    <Country country_id="GB" region_id="10">
      <country_name>United Kingdom of Great Britain and Northern Ireland</country_name>
    </Country>
    <Country country_id="FR" region_id="10">
      <country_name>France</country_name>
    </Country>
    <Country country_id="DE" region_id="10">
      <country_name>Germany</country_name>
    </Country>
    <Country country_id="ZM" region_id="50">
      <country_name>Zambia</country_name>
    </Country>
    <Country country_id="EG" region_id="50">
      <country_name>Egypt</country_name>
    </Country>
    <Country country_id="BR" region_id="20">
      <country_name>Brazil</country_name>
    </Country>
    <Country country_id="CH" region_id="10">
      <country_name>Switzerland</country_name>
    </Country>
    <Country country_id="NL" region_id="10">
      <country_name>Netherlands</country_name>
    </Country>
    <Country country_id="MX" region_id="20">
      <country_name>Mexico</country_name>
    </Country>
    <Country country_id="KW" region_id="30">
      <country_name>Kuwait</country_name>
    </Country>
    <Country country_id="IL" region_id="30">
      <country_name>Israel</country_name>
    </Country>
    <Country country_id="DK" region_id="10">
      <country_name>Denmark</country_name>
    </Country>
    <Country country_id="ML" region_id="30">
      <country_name>Malaysia</country_name>
    </Country>
    <Country country_id="NG" region_id="50">
      <country_name>Nigeria</country_name>
    </Country>
    <Country country_id="AR" region_id="20">
      <country_name>Argentina</country_name>
    </Country>
    <Country country_id="BE" region_id="10">
      <country_name>Belgium</country_name>
    </Country>
  </Countries>
  <Locations>
    <Location location_id="1000" country_id="IT">
      <street_address>1297 Via Cola di Rie</street_address>
      <postal_code>00989</postal_code>
      <city>Roma</city>
    </Location>
    <Location location_id="1100" country_id="IT">
      <street_address>93091 Calle della Testa</street_address>
      <postal_code>10934</postal_code>
      <city>Venice</city>
    </Location>
    <Location location_id="1200" country_id="JP">
      <street_address>2017 Shinjuku-ku</street_address>
      <postal_code>1689</postal_code>
      <city>Tokyo</city>
      <state_province>Tokyo Prefecture</state_province>
    </Location>
    <Location location_id="1300" country_id="JP">
      <street_address>9450 Kamiya-cho</street_address>
      <postal_code>6823</postal_code>
      <city>Hiroshima</city>
    </Location>
    <Location location_id="1400" country_id="US">
      <street_address>2014 Jabberwocky Rd</street_address>
      <postal_code>26192</postal_code>
      <city>Southlake</city>
      <state_province>Texas</state_province>
    </Location>
    <Location location_id="1500" country_id="US">
      <street_address>2011 Interiors Blvd</street_address>
      <postal_code>99236</postal_code>
      <city>South San Francisco</city>
      <state_province>California</state_province>
    </Location>
    <Location location_id="1600" country_id="US">
      <street_address>2007 Zagora St</street_address>
      <postal_code>50090</postal_code>
      <city>South Brunswick</city>
      <state_province>New Jersey</state_province>
    </Location>
    <Location location_id="1700" country_id="US">
      <street_address>2004 Charade Rd</street_address>
      <postal_code>98199</postal_code>
      <city>Seattle</city>
      <state_province>Washington</state_province>
    </Location>
    <Location location_id="1800" country_id="CA">
      <street_address>147 Spadina Ave</street_address>
      <postal_code>M5V 2L7</postal_code>
      <city>Toronto</city>
      <state_province>Ontario</state_province>
    </Location>
    <Location location_id="1900" country_id="CA">
      <street_address>6092 Boxwood St</street_address>
      <postal_code>YSW 9T2</postal_code>
      <city>Whitehorse</city>
      <state_province>Yukon</state_province>
    </Location>
    <Location location_id="2000" country_id="CN">
      <street_address>40-5-12 Laogianggen</street_address>
      <postal_code>190518</postal_code>
      <city>Beijing</city>
    </Location>
    <Location location_id="2100" country_id="IN">
      <street_address>1298 Vileparle (E)</street_address>
      <postal_code>490231</postal_code>
      <city>Bombay</city>
      <state_province>Maharashtra</state_province>
    </Location>
    <Location location_id="2200" country_id="AU">
      <street_address>12-98 Victoria Street</street_address>
      <postal_code>2901</postal_code>
      <city>Sydney</city>
      <state_province>New South Wales</state_province>
    </Location>
    <Location location_id="2300" country_id="SG">
      <street_address>198 Clementi North</street_address>
      <postal_code>540198</postal_code>
      <city>Singapore</city>
    </Location>
    <Location location_id="2400" country_id="GB">
      <street_address>8204 Arthur St</street_address>
      <city>London</city>
    </Location>
    <Location location_id="2500" country_id="GB">
      <street_address>Magdalen Centre, The Oxford Science Park</street_address>
      <postal_code>OX9 9ZB</postal_code>
      <city>Oxford</city>
      <state_province>Oxford</state_province>
    </Location>
    <Location location_id="2600" country_id="GB">
      <street_address>9702 Chester Road</street_address>
      <postal_code>09629850293</postal_code>
      <city>Stretford</city>
      <state_province>Manchester</state_province>
    </Location>
    <Location location_id="2700" country_id="DE">
      <street_address>Schwanthalerstr. 7031</street_address>
      <postal_code>80925</postal_code>
      <city>Munich</city>
      <state_province>Bavaria</state_province>
    </Location>
    <Location location_id="2800" country_id="BR">
      <street_address>Rua Frei Caneca 1360 </street_address>
      <postal_code>01307-002</postal_code>
      <city>Sao Paulo</city>
      <state_province>Sao Paulo</state_province>
    </Location>
    <Location location_id="2900" country_id="CH">
      <street_address>20 Rue des Corps-Saints</street_address>
      <postal_code>1730</postal_code>
      <city>Geneva</city>
      <state_province>Geneve</state_province>
    </Location>
    <Location location_id="3000" country_id="CH">
      <street_address>Murtenstrasse 921</street_address>
      <postal_code>3095</postal_code>
      <city>Bern</city>
      <state_province>BE</state_province>
    </Location>
    <Location location_id="3100" country_id="NL">
      <street_address>Pieter Breughelstraat 837</street_address>
      <postal_code>3029SK</postal_code>
      <city>Utrecht</city>
      <state_province>Utrecht</state_province>
    </Location>
    <Location location_id="3200" country_id="MX">
      <street_address>Mariano Escobedo 9991</street_address>
      <postal_code>11932</postal_code>
      <city>Mexico City</city>
      <state_province>Distrito Federal</state_province>
    </Location>
  </Locations>
  <Departments>
    <Department department_id="10" manager_id="200" location_id="1700">
      <department_name>Administration</department_name>
    </Department>
    <Department department_id="20" manager_id="201" location_id="1800">
      <department_name>Marketing</department_name>
    </Department>
    <Department department_id="30" manager_id="114" location_id="1700">
      <department_name>Purchasing</department_name>
    </Department>
    <Department department_id="40" manager_id="203" location_id="2400">
      <department_name>Human Resources</department_name>
    </Department>
    <Department department_id="50" manager_id="121" location_id="1500">
      <department_name>Shipping</department_name>
    </Department>
    <Department department_id="60" manager_id="103" location_id="1400">
      <department_name>IT</department_name>
    </Department>
    <Department department_id="70" manager_id="204" location_id="2700">
      <department_name>Public Relations</department_name>
    </Department>
    <Department department_id="80" manager_id="145" location_id="2500">
      <department_name>Sales</department_name>
    </Department>
    <Department department_id="90" manager_id="100" location_id="1700">
      <department_name>Executive</department_name>
    </Department>
    <Department department_id="100" manager_id="108" location_id="1700">
      <department_name>Finance</department_name>
    </Department>